{
  "$schema": "http://json-schema.org/draft-07/schema#",
  "type": "object",
  "properties": {
    "moduleName": {
      "type": "string"
    },
    "moduleDescription": {
      "type": "string"
    },
    "moduleMetadata": {
      "type": "object",
      "properties": {
        "author": {"type": "string"},
        "version": {"type": "string"},
        "levelRange": {
          "type": "object",
          "properties": {
            "min": {"type": "integer"},
            "max": {"type": "integer"}
          },
          "required": ["min", "max"]
        },
        "estimatedPlayTime": {"type": "string"},
        "moduleType": {
          "type": "string",
          "enum": ["adventure", "dungeon", "wilderness", "urban", "module_arc"]
        },
        "_srd_attribution": {"type": "string"}
      },
      "required": ["author", "version", "levelRange", "estimatedPlayTime", "moduleType"]
    },
    "moduleConflicts": {
      "type": "array",
      "items": {
        "type": "object",
        "properties": {
          "conflictName": {
            "type": "string",
            "description": "Name of the local conflict"
          },
          "description": {
            "type": "string", 
            "description": "Detailed description of the conflict"
          },
          "scope": {
            "type": "string",
            "enum": ["local", "regional"],
            "description": "Geographic scope of the conflict"
          },
          "impact": {
            "type": "string",
            "description": "How this conflict affects module gameplay"
          }
        },
        "required": ["conflictName", "description", "scope", "impact"]
      },
      "description": "Optional array of conflicts affecting this module's gameplay"
    },
    "mainPlot": {
      "type": "object",
      "properties": {
        "mainObjective": {
          "type": "string"
        },
        "antagonist": {
          "type": "string"
        },
        "plotStages": {
          "type": "array",
          "items": {
            "type": "object",
            "properties": {
              "stageName": {
                "type": "string"
              },
              "stageDescription": {
                "type": "string"
              },
              "requiredLevel": {
                "type": "integer"
              },
              "keyNPCs": {
                "type": "array",
                "items": {
                  "type": "string"
                }
              },
              "majorEvents": {
                "type": "array",
                "items": {
                  "type": "string"
                }
              }
            },
            "required": ["stageName", "stageDescription", "requiredLevel", "keyNPCs", "majorEvents"]
          }
        }
      },
      "required": ["mainObjective", "antagonist", "plotStages"]
    },
    "factions": {
      "type": "array",
      "items": {
        "type": "object",
        "properties": {
          "factionName": {
            "type": "string"
          },
          "factionDescription": {
            "type": "string"
          },
          "alignment": {
            "type": "string",
            "enum": ["lawful good", "neutral good", "chaotic good", "lawful neutral", "neutral", "chaotic neutral", "lawful evil", "neutral evil", "chaotic evil"]
          },
          "goals": {
            "type": "array",
            "items": {
              "type": "string"
            }
          },
          "keyMembers": {
            "type": "array",
            "items": {
              "type": "string"
            }
          }
        },
        "required": ["factionName", "factionDescription", "alignment", "goals", "keyMembers"]
      }
    },
    "worldMap": {
      "type": "array",
      "items": {
        "type": "object",
        "properties": {
          "regionName": {
            "type": "string"
          },
          "regionDescription": {
            "type": "string"
          },
          "mapId": {
            "type": "string"
          },
          "dangerLevel": {
            "type": "string",
            "enum": ["low", "medium", "high", "extreme"]
          },
          "recommendedLevel": {
            "type": "integer"
          },
          "levels": {
            "type": "array",
            "items": {
              "type": "object",
              "properties": {
                "name": {
                  "type": "string"
                },
                "id": {
                  "type": "string"
                },
                "description": {
                  "type": "string"
                }
              },
              "required": ["name", "id", "description"]
            }
          }
        },
        "required": ["regionName", "regionDescription", "mapId", "dangerLevel", "recommendedLevel", "levels"]
      }
    },
    "timelineEvents": {
      "type": "array",
      "items": {
        "type": "object",
        "properties": {
          "eventName": {
            "type": "string"
          },
          "eventDescription": {
            "type": "string"
          },
          "triggerCondition": {
            "type": "string"
          },
          "impact": {
            "type": "string"
          }
        },
        "required": ["eventName", "eventDescription", "triggerCondition", "impact"]
      }
    }
  },
  "required": ["moduleName", "moduleDescription", "moduleMetadata", "mainPlot", "factions", "worldMap", "timelineEvents"]
}