{
  "moduleName": "Keep of Doom",
  "moduleDescription": "Adventurers must brave a haunted keep to confront a cursed knight and a sinister artifact, risking supernatural doom or unleashing darkness upon the land.",
  "moduleMetadata": {
    "author": "DM Assistant",
    "version": "1.0.0",
    "levelRange": {
      "min": 1,
      "max": 3
    },
    "estimatedPlayTime": "4-6 sessions",
    "moduleType": "adventure",
    "_srd_attribution": "Portions derived from SRD 5.2.1, CC BY 4.0"
  },
  "mainPlot": {
    "mainObjective": "Uncover the truth behind the cursed noble and the malevolent artifact haunting the keep, then decide whether to destroy the artifact\u2014risking catastrophic magical backlash\u2014or bind its power, shaping the fate of Shadowvale and its people.",
    "antagonist": "Sir Garran Vael, the once-honorable lord of the keep, now a tormented undead knight bound by a sentient shadow relic that feeds on despair. Driven mad by centuries of isolation and the artifact\u2019s whispers, Sir Garran seeks to break his curse\u2014even if it means unleashing the relic\u2019s dark power upon Shadowvale.",
    "plotStages": [
      {
        "stageName": "Shadows Over the Village",
        "stageDescription": "The adventurers arrive in the fearful border village beneath the keep. They learn of the nightly moans, missing livestock, and rumors of a cursed noble. The village elder hires the party to investigate, offering what little aid they can spare. The party must gather information, win the trust of suspicious villagers, and prepare for the journey through the haunted woods.",
        "requiredLevel": 1,
        "keyNPCs": [
          "Elder Mirna Harrow (village elder)",
          "Old Tommen (superstitious herdsman)",
          "Cira the Innkeeper"
        ],
        "majorEvents": [
          "Party is hired to investigate the keep",
          "Strange omens and attacks escalate",
          "Clues point to the keep's tragic history"
        ]
      },
      {
        "stageName": "Through the Haunted Woods",
        "stageDescription": "The party treks through the shadowed forest separating the village from the keep. They must navigate shifting trails, spectral illusions, and lurking undead. Along the way, they encounter remnants of old wards and evidence of past tragedies, hinting at the keep\u2019s grim legacy.",
        "requiredLevel": 1,
        "keyNPCs": [
          "Wandering Shade (restless spirit)",
          "Scout Elen (missing villager, possibly rescued)"
        ],
        "majorEvents": [
          "Ambushed by Shadows (spectral guardians)",
          "Discover a lost warding talisman",
          "Rescue or learn the fate of a missing villager"
        ]
      },
      {
        "stageName": "The Forsaken Keep",
        "stageDescription": "The adventurers infiltrate the crumbling keep, navigating ancient traps and haunted halls. They uncover journals and clues revealing Sir Garran Vael\u2019s tragic fall and the artifact\u2019s sinister influence. The keep\u2019s spectral defenders test their resolve, and glimpses of the cursed knight foreshadow the final confrontation.",
        "requiredLevel": 2,
        "keyNPCs": [
          "Sir Garran Vael (cursed knight)",
          "Spectral Scribe (ghostly historian)",
          "The Shadow Relic (sentient artifact, communicates telepathically)"
        ],
        "majorEvents": [
          "Bypass or disarm ancient traps",
          "Face waves of spectral defenders",
          "Uncover Sir Garran\u2019s journals and the artifact\u2019s history"
        ]
      },
      {
        "stageName": "Confronting the Cursed Knight",
        "stageDescription": "The party reaches the heart of the keep\u2014a desecrated throne room where Sir Garran Vael awaits, tormented by the shadow relic. A tense battle and negotiation unfold as the knight\u2019s tragic motives come to light. The adventurers must overcome or persuade him, then choose how to deal with the artifact\u2019s power.",
        "requiredLevel": 3,
        "keyNPCs": [
          "Sir Garran Vael",
          "The Shadow Relic"
        ],
        "majorEvents": [
          "Climactic battle or negotiation with Sir Garran",
          "Revelation of the artifact\u2019s true nature",
          "Moral choice: destroy or bind the relic"
        ]
      },
      {
        "stageName": "Aftermath and New Shadows",
        "stageDescription": "The party\u2019s decision ripples through Shadowvale, reshaping the fate of the keep and the surrounding lands. Destroying the artifact risks a magical backlash and vengeful spirits; binding it preserves the threat but offers new power. The village responds with gratitude, suspicion, or fear, and ominous signs hint at greater dangers awakened by the adventurers\u2019 actions.",
        "requiredLevel": 3,
        "keyNPCs": [
          "Elder Mirna Harrow",
          "Agents of the Black Banner (optional future threat)"
        ],
        "majorEvents": [
          "Consequences of the party\u2019s choice unfold",
          "Village and regional powers react",
          "Hints of future threats or module hooks revealed"
        ]
      }
    ]
  },
  "factions": [
    {
      "factionName": "The Order of the Silver Vigil",
      "factionDescription": "A zealous order of knights and clerics dedicated to rooting out undead and dark magic across Shadowvale. Their methods are strict and sometimes heavy-handed, but they are often the region\u2019s best hope against supernatural threats.",
      "alignment": "lawful good",
      "goals": [
        "Eradicate undead in the region",
        "Destroy or secure dangerous magical artifacts",
        "Restore order and faith in the borderlands"
      ],
      "keyMembers": [
        "Dame Elira Dawnsworn",
        "Brother Jorlan",
        "Sergeant Mara Feld"
      ]
    },
    {
      "factionName": "The Black Banner",
      "factionDescription": "A secretive cabal of spies, thieves, and warlocks exploiting Shadowvale\u2019s fear and chaos for personal gain. They manipulate events from the shadows, seeking profit and forbidden secrets, sometimes sabotaging both sides of a conflict.",
      "alignment": "neutral evil",
      "goals": [
        "Acquire and sell forbidden relics",
        "Destabilize local authorities",
        "Recruit desperate villagers and outcasts"
      ],
      "keyMembers": [
        "Varek the Shade",
        "Mistress Ilyra",
        "Garrik Two-Fingers"
      ]
    },
    {
      "factionName": "Council of Eldermere",
      "factionDescription": "A pragmatic assembly of merchants and minor nobles from the Free Cities of Eldermere. Focused on trade and mutual defense, they approach the hauntings as a threat to commerce and regional stability, preferring negotiation and subtle influence to open conflict.",
      "alignment": "lawful neutral",
      "goals": [
        "Reopen and secure trade routes",
        "Broker alliances with local powers",
        "Contain supernatural threats diplomatically"
      ],
      "keyMembers": [
        "Magister Corvin Leth",
        "Lady Mirielle d'Ashe",
        "Envoy Torric"
      ]
    },
    {
      "factionName": "Circle of the Wild Heart",
      "factionDescription": "A reclusive circle of druids and rangers who protect the forests and wild creatures of Shadowvale. They distrust outsiders but can be powerful allies\u2014or obstacles\u2014depending on how the adventurers treat the land and its spirits.",
      "alignment": "chaotic good",
      "goals": [
        "Preserve the balance of nature",
        "Prevent the spread of undead corruption",
        "Safeguard ancient woodland sites"
      ],
      "keyMembers": [
        "Druidess Halwen",
        "Ranger Branik",
        "Feyfriend Lirael"
      ]
    }
  ],
  "worldMap": [
    {
      "regionName": "Harrow's Hollow",
      "regionDescription": "A mist-shrouded border village crouching at the edge of the haunted woods. Simple folk eke out a living under the looming shadow of the old keep, tormented by nightly terrors and vanishing livestock. The villagers are wary but desperate for aid.",
      "mapId": "HH001",
      "dangerLevel": "low",
      "recommendedLevel": 1,
      "levels": [
        {
          "name": "Village Green",
          "id": "HH001-A",
          "description": "The communal heart of Harrow's Hollow, where villagers gather for news, trade, and rumor."
        },
        {
          "name": "The Crooked Mare Inn",
          "id": "HH001-B",
          "description": "A battered inn offering food, warmth, and the latest whispers about the haunted keep."
        },
        {
          "name": "Elder Mirna\u2019s Cottage",
          "id": "HH001-C",
          "description": "The modest but sturdy home of the village elder, cluttered with family relics and warding charms."
        },
        {
          "name": "Abandoned Farmstead",
          "id": "HH001-D",
          "description": "A derelict farm at the village\u2019s edge, its fields choked with weeds and an air of lingering sorrow."
        }
      ]
    },
    {
      "regionName": "Gloamwood",
      "regionDescription": "A dense, brooding forest where sunlight rarely pierces the canopy. Ethereal mists swirl between ancient oaks, and spirits of the restless dead prowl the trails. Travelers risk losing both their way and their lives.",
      "mapId": "G001",
      "dangerLevel": "medium",
      "recommendedLevel": 1,
      "levels": [
        {
          "name": "Witchlight Path",
          "id": "G001-A",
          "description": "The main trail winding through the Gloamwood, marked by flickering, unnatural lights."
        },
        {
          "name": "The Withered Shrine",
          "id": "G001-B",
          "description": "A crumbling altar to forgotten gods, overgrown and haunted by a lingering spirit."
        },
        {
          "name": "Lost Ward Circle",
          "id": "G001-C",